{
  "receipt_version": "1.0",
  "run_id": "rate-limit-pass",
  "task": {
    "task_id": "rate-limit-demo",
    "title": "Implement login rate limiting",
    "goal": "Limit login attempts to five per minute and return HTTP 429 after the limit.",
    "constraints": [
      "Existing auth tests remain green"
    ],
    "allowed_paths": [
      "src/auth.ts",
      "tests/auth.test.ts"
    ],
    "acceptance_criteria": [
      {
        "id": "AC-01",
        "statement": "At most five failed attempts per client are accepted in one minute.",
        "required": true,
        "verification_refs": [
          "per-client-rate-limit"
        ]
      },
      {
        "id": "AC-02",
        "statement": "The sixth failed HTTP login attempt returns 429.",
        "required": true,
        "verification_refs": [
          "sixth-attempt-http-429"
        ]
      }
    ],
    "verification_commands": [
      {
        "id": "per-client-rate-limit",
        "name": "per-client-rate-limit",
        "command": "node verify-rate-limit.mjs",
        "category": "test"
      },
      {
        "id": "sixth-attempt-http-429",
        "name": "sixth-attempt-http-429",
        "command": "node verify-http-429.mjs",
        "category": "test"
      }
    ],
    "workspace": "<WORKSPACE>",
    "model": "fixture-model"
  },
  "agent": {
    "model": "fixture-model",
    "status": "COMPLETED",
    "error": null,
    "execution_mode": "FAKE_ADAPTER"
  },
  "context": {
    "files_considered": 0,
    "files_supplied": 0,
    "approximate_tokens": 0,
    "selected_paths": [],
    "accessed_files": null,
    "access_observation": "UNAVAILABLE",
    "evidence_ids": [
      "ev_ea4c8b4c9917783f1b8d"
    ]
  },
  "actions": {
    "events": 1,
    "tool_calls": 0,
    "evidence_ids": [
      "ev_149bfeb5e115b3fd7008"
    ]
  },
  "changes": {
    "changed_files": [
      "src/auth.ts"
    ],
    "additions": 3,
    "deletions": 0,
    "evidence_ids": [
      "ev_18c04d651439a90ba589"
    ]
  },
  "verification": {
    "results": [
      {
        "verifier_id": "per-client-rate-limit",
        "name": "per-client-rate-limit",
        "category": "test",
        "command": "node verify-rate-limit.mjs",
        "exit_code": 0,
        "stdout": "fixture verifier: PASS",
        "stderr": "",
        "duration_ms": 4,
        "status": "PASSED"
      },
      {
        "verifier_id": "sixth-attempt-http-429",
        "name": "sixth-attempt-http-429",
        "category": "test",
        "command": "node verify-http-429.mjs",
        "exit_code": 0,
        "stdout": "fixture verifier: PASS",
        "stderr": "",
        "duration_ms": 4,
        "status": "PASSED"
      }
    ],
    "evidence_ids": [
      "ev_e342f707f015fcdcb767",
      "ev_88767e366b2e4b52cd2c"
    ]
  },
  "evidence": [
    {
      "evidence_id": "ev_ea4c8b4c9917783f1b8d",
      "run_id": "rate-limit-pass",
      "type": "CONTEXT_EVIDENCE",
      "source": "sqlite:runs.context_manifest",
      "summary": "0 files supplied from 0 considered",
      "raw_reference": "run:rate-limit-pass:context",
      "confidence_class": "DETERMINISTIC",
      "created_at": "2026-09-22T10:00:01.000Z",
      "data": {
        "files_considered": 0,
        "files_included": 0,
        "approximate_tokens": 0
      }
    },
    {
      "evidence_id": "ev_18c04d651439a90ba589",
      "run_id": "rate-limit-pass",
      "type": "DIFF_EVIDENCE",
      "source": "sqlite:runs.diff",
      "summary": "1 files changed (+3/-0)",
      "raw_reference": "run:rate-limit-pass:diff",
      "confidence_class": "DETERMINISTIC",
      "created_at": "2026-09-22T10:00:02.000Z",
      "data": {
        "status_before": "",
        "status_after": "M src/auth.ts",
        "changed_files": [
          "src/auth.ts"
        ],
        "additions": 3,
        "deletions": 0,
        "unified_diff": "synthetic fixture diff"
      }
    },
    {
      "evidence_id": "ev_e342f707f015fcdcb767",
      "run_id": "rate-limit-pass",
      "type": "TEST_EVIDENCE",
      "source": "sqlite:verification_results",
      "summary": "per-client-rate-limit: PASSED",
      "raw_reference": "run:rate-limit-pass:verification:0",
      "confidence_class": "DETERMINISTIC",
      "created_at": "2026-09-22T10:00:02.000Z",
      "data": {
        "verifier_id": "per-client-rate-limit",
        "name": "per-client-rate-limit",
        "category": "test",
        "command": "node verify-rate-limit.mjs",
        "exit_code": 0,
        "stdout": "fixture verifier: PASS",
        "stderr": "",
        "duration_ms": 4,
        "status": "PASSED"
      }
    },
    {
      "evidence_id": "ev_88767e366b2e4b52cd2c",
      "run_id": "rate-limit-pass",
      "type": "TEST_EVIDENCE",
      "source": "sqlite:verification_results",
      "summary": "sixth-attempt-http-429: PASSED",
      "raw_reference": "run:rate-limit-pass:verification:1",
      "confidence_class": "DETERMINISTIC",
      "created_at": "2026-09-22T10:00:02.000Z",
      "data": {
        "verifier_id": "sixth-attempt-http-429",
        "name": "sixth-attempt-http-429",
        "category": "test",
        "command": "node verify-http-429.mjs",
        "exit_code": 0,
        "stdout": "fixture verifier: PASS",
        "stderr": "",
        "duration_ms": 4,
        "status": "PASSED"
      }
    },
    {
      "evidence_id": "ev_149bfeb5e115b3fd7008",
      "run_id": "rate-limit-pass",
      "type": "ASSERTION_EVIDENCE",
      "source": "sqlite:events",
      "summary": "1 ordered events and 0 persisted tool calls",
      "raw_reference": "run:rate-limit-pass:events",
      "confidence_class": "DETERMINISTIC",
      "created_at": "2026-09-22T10:00:02.000Z",
      "data": {
        "events": 1,
        "tool_calls": 0
      }
    }
  ],
  "acceptance": [
    {
      "criterion_id": "AC-01",
      "description": "At most five failed attempts per client are accepted in one minute.",
      "required": true,
      "status": "PASS",
      "evidence_ids": [
        "ev_e342f707f015fcdcb767"
      ],
      "reason": "Every referenced verifier passed with deterministic evidence."
    },
    {
      "criterion_id": "AC-02",
      "description": "The sixth failed HTTP login attempt returns 429.",
      "required": true,
      "status": "PASS",
      "evidence_ids": [
        "ev_88767e366b2e4b52cd2c"
      ],
      "reason": "Every referenced verifier passed with deterministic evidence."
    }
  ],
  "outcome": "PASS",
  "generated_at": "2026-09-22T10:00:03.000Z"
}
