{
  "receipt_version": "1.0",
  "run_id": "5adbd5ff-5e8d-4f04-93dc-df2c0f8bac56",
  "task": {
    "task_id": "refactor",
    "title": "Normalize display names",
    "constraints": [
      "Use only the allowed paths.",
      "Run node verify.mjs before claiming completion."
    ],
    "allowed_paths": [
      "src/format.js"
    ],
    "acceptance_criteria": [
      "Refactor formatName so it trims surrounding whitespace and collapses repeated internal spaces."
    ],
    "verification_commands": [
      {
        "name": "external-verifier",
        "command": "node verify.mjs",
        "category": "custom"
      }
    ],
    "workspace": "C:\\Users\\ardao\\w2\\benchmarks\\runs\\w2\\refactor",
    "timeout_ms": 20000
  },
  "agent": {
    "model": "codex",
    "status": "FAILED",
    "error": "Agent failure: Codex process timed out after 20000ms"
  },
  "context": {
    "files_considered": 6,
    "files_supplied": 1,
    "approximate_tokens": 17,
    "evidence_ids": [
      "ev_d3303cc57b8177d12df1"
    ]
  },
  "actions": {
    "events": 28,
    "tool_calls": 3,
    "evidence_ids": [
      "ev_04ad2f377a5fde442621",
      "ev_db6b6634db30617479f2",
      "ev_62df96f000a6e563034d",
      "ev_103997d25c0971915a9e",
      "ev_022b077a3be36f67b379",
      "ev_1f49af19a3175d7c4ca3"
    ]
  },
  "changes": {
    "changed_files": [
      "src/format.js",
      "w2-run.sqlite",
      "w2-run.sqlite-shm",
      "w2-run.sqlite-wal"
    ],
    "additions": 1,
    "deletions": 1,
    "evidence_ids": [
      "ev_2f01e88153c88b25fb0c"
    ]
  },
  "verification": {
    "results": [],
    "evidence_ids": []
  },
  "evidence": [
    {
      "evidence_id": "ev_d3303cc57b8177d12df1",
      "run_id": "5adbd5ff-5e8d-4f04-93dc-df2c0f8bac56",
      "type": "CONTEXT_EVIDENCE",
      "source": "sqlite:runs.context_manifest",
      "summary": "1 files supplied from 6 considered",
      "raw_reference": "run:5adbd5ff-5e8d-4f04-93dc-df2c0f8bac56:context",
      "confidence_class": "DETERMINISTIC",
      "created_at": "2026-09-22T14:34:38.419Z",
      "data": {
        "files_considered": 6,
        "files_included": 1,
        "approximate_tokens": 17
      }
    },
    {
      "evidence_id": "ev_04ad2f377a5fde442621",
      "run_id": "5adbd5ff-5e8d-4f04-93dc-df2c0f8bac56",
      "type": "TOOL_EVIDENCE",
      "source": "sqlite:tool_calls",
      "summary": "shell executed",
      "raw_reference": "run:5adbd5ff-5e8d-4f04-93dc-df2c0f8bac56:tool:0",
      "confidence_class": "DETERMINISTIC",
      "created_at": "2026-09-22T14:34:38.416Z",
      "data": {
        "tool_name": "shell",
        "input": {
          "command": "git",
          "args": [
            "status",
            "--porcelain=v1"
          ]
        },
        "result": {
          "stdout": "?? w2-run.sqlite\n?? w2-run.sqlite-shm\n?? w2-run.sqlite-wal\n",
          "stderr": "",
          "exitCode": 0
        }
      }
    },
    {
      "evidence_id": "ev_db6b6634db30617479f2",
      "run_id": "5adbd5ff-5e8d-4f04-93dc-df2c0f8bac56",
      "type": "TOOL_EVIDENCE",
      "source": "sqlite:tool_calls",
      "summary": "shell executed",
      "raw_reference": "run:5adbd5ff-5e8d-4f04-93dc-df2c0f8bac56:tool:1",
      "confidence_class": "DETERMINISTIC",
      "created_at": "2026-09-22T14:34:58.497Z",
      "data": {
        "tool_name": "shell",
        "input": {
          "command": "git",
          "args": [
            "status",
            "--porcelain=v1"
          ]
        },
        "result": {
          "stdout": " M src/format.js\n?? w2-run.sqlite\n?? w2-run.sqlite-shm\n?? w2-run.sqlite-wal\n",
          "stderr": "",
          "exitCode": 0
        }
      }
    },
    {
      "evidence_id": "ev_62df96f000a6e563034d",
      "run_id": "5adbd5ff-5e8d-4f04-93dc-df2c0f8bac56",
      "type": "TOOL_EVIDENCE",
      "source": "sqlite:tool_calls",
      "summary": "shell executed",
      "raw_reference": "run:5adbd5ff-5e8d-4f04-93dc-df2c0f8bac56:tool:2",
      "confidence_class": "DETERMINISTIC",
      "created_at": "2026-09-22T14:34:58.532Z",
      "data": {
        "tool_name": "shell",
        "input": {
          "command": "git",
          "args": [
            "diff",
            "HEAD",
            "--numstat"
          ]
        },
        "result": {
          "stdout": "1\t1\tsrc/format.js\n",
          "stderr": "warning: in the working copy of 'src/format.js', LF will be replaced by CRLF the next time Git touches it\n",
          "exitCode": 0
        }
      }
    },
    {
      "evidence_id": "ev_103997d25c0971915a9e",
      "run_id": "5adbd5ff-5e8d-4f04-93dc-df2c0f8bac56",
      "type": "TOOL_EVIDENCE",
      "source": "sqlite:tool_calls",
      "summary": "shell executed",
      "raw_reference": "run:5adbd5ff-5e8d-4f04-93dc-df2c0f8bac56:tool:3",
      "confidence_class": "DETERMINISTIC",
      "created_at": "2026-09-22T14:34:58.533Z",
      "data": {
        "tool_name": "shell",
        "input": {
          "command": "git",
          "args": [
            "diff",
            "HEAD",
            "--"
          ]
        },
        "result": {
          "stdout": "diff --git a/src/format.js b/src/format.js\nindex 97e5726..348e2fa 100644\n--- a/src/format.js\n+++ b/src/format.js\n@@ -1 +1 @@\n-export function formatName(value) { return value.toUpperCase(); }\n+export function formatName(value) { return value.trim().replace(/\\s+/g, ' ').toUpperCase(); }\n",
          "stderr": "warning: in the working copy of 'src/format.js', LF will be replaced by CRLF the next time Git touches it\n",
          "exitCode": 0
        }
      }
    },
    {
      "evidence_id": "ev_2f01e88153c88b25fb0c",
      "run_id": "5adbd5ff-5e8d-4f04-93dc-df2c0f8bac56",
      "type": "DIFF_EVIDENCE",
      "source": "sqlite:runs.diff",
      "summary": "4 files changed (+1/-1)",
      "raw_reference": "run:5adbd5ff-5e8d-4f04-93dc-df2c0f8bac56:diff",
      "confidence_class": "DETERMINISTIC",
      "created_at": "2026-09-22T14:34:58.535Z",
      "data": {
        "status_before": "?? w2-run.sqlite\n?? w2-run.sqlite-shm\n?? w2-run.sqlite-wal\n",
        "status_after": " M src/format.js\n?? w2-run.sqlite\n?? w2-run.sqlite-shm\n?? w2-run.sqlite-wal\n",
        "changed_files": [
          "src/format.js",
          "w2-run.sqlite",
          "w2-run.sqlite-shm",
          "w2-run.sqlite-wal"
        ],
        "additions": 1,
        "deletions": 1,
        "unified_diff": "diff --git a/src/format.js b/src/format.js\nindex 97e5726..348e2fa 100644\n--- a/src/format.js\n+++ b/src/format.js\n@@ -1 +1 @@\n-export function formatName(value) { return value.toUpperCase(); }\n+export function formatName(value) { return value.trim().replace(/\\s+/g, ' ').toUpperCase(); }\n"
      }
    },
    {
      "evidence_id": "ev_022b077a3be36f67b379",
      "run_id": "5adbd5ff-5e8d-4f04-93dc-df2c0f8bac56",
      "type": "ASSERTION_EVIDENCE",
      "source": "sqlite:events",
      "summary": "28 ordered events and 3 persisted tool calls",
      "raw_reference": "run:5adbd5ff-5e8d-4f04-93dc-df2c0f8bac56:events",
      "confidence_class": "DETERMINISTIC",
      "created_at": "2026-09-22T14:34:58.535Z",
      "data": {
        "events": 28,
        "tool_calls": 3
      }
    },
    {
      "evidence_id": "ev_1f49af19a3175d7c4ca3",
      "run_id": "5adbd5ff-5e8d-4f04-93dc-df2c0f8bac56",
      "type": "ASSERTION_EVIDENCE",
      "source": "sqlite:events",
      "summary": "3 safety and durability events",
      "raw_reference": "run:5adbd5ff-5e8d-4f04-93dc-df2c0f8bac56:safety",
      "confidence_class": "DETERMINISTIC",
      "created_at": "2026-09-22T14:34:58.465Z",
      "data": [
        {
          "event_id": "df604e76-b974-4caa-9b7b-c8883e72bf0b",
          "run_id": "5adbd5ff-5e8d-4f04-93dc-df2c0f8bac56",
          "sequence": 2,
          "timestamp": "2026-09-22T14:34:38.382Z",
          "type": "run_checkpointed",
          "payload": {
            "sequence": 1,
            "completed_tool_calls": 0,
            "verification_progress": 0
          }
        },
        {
          "event_id": "048aec28-f6ee-45d7-b8f2-54995b040e07",
          "run_id": "5adbd5ff-5e8d-4f04-93dc-df2c0f8bac56",
          "sequence": 7,
          "timestamp": "2026-09-22T14:34:38.421Z",
          "type": "run_checkpointed",
          "payload": {
            "sequence": 6,
            "completed_tool_calls": 1,
            "verification_progress": 0
          }
        },
        {
          "event_id": "c096c04b-6c70-4d63-890d-d156333dab91",
          "run_id": "5adbd5ff-5e8d-4f04-93dc-df2c0f8bac56",
          "sequence": 22,
          "timestamp": "2026-09-22T14:34:58.465Z",
          "type": "run_checkpointed",
          "payload": {
            "sequence": 21,
            "completed_tool_calls": 1,
            "verification_progress": 0
          }
        }
      ]
    }
  ],
  "acceptance": [
    {
      "criterion_id": "AC-01",
      "description": "Refactor formatName so it trims surrounding whitespace and collapses repeated internal spaces.",
      "required": true,
      "status": "UNPROVEN",
      "evidence_ids": [],
      "reason": "No evidence was mapped to this required criterion."
    }
  ],
  "outcome": "UNPROVEN",
  "generated_at": "2026-09-22T14:34:58.539Z"
}
