{
  "receipt_version": "1.0",
  "run_id": "4296fcb3-b3e9-45de-b456-d49a54c06348",
  "task": {
    "task_id": "test-repair",
    "title": "Repair date formatting",
    "constraints": [
      "Use only the allowed paths.",
      "Run node verify.mjs before claiming completion."
    ],
    "allowed_paths": [
      "src/date.js"
    ],
    "acceptance_criteria": [
      "Make isoDate return a UTC ISO date string for a Date input."
    ],
    "verification_commands": [
      {
        "name": "external-verifier",
        "command": "node verify.mjs",
        "category": "custom"
      }
    ],
    "workspace": "C:\\Users\\ardao\\w2\\benchmarks\\runs\\w2\\test-repair",
    "timeout_ms": 20000
  },
  "agent": {
    "model": "codex",
    "status": "FAILED",
    "error": "Agent failure: Codex process timed out after 20000ms"
  },
  "context": {
    "files_considered": 6,
    "files_supplied": 1,
    "approximate_tokens": 15,
    "evidence_ids": [
      "ev_efe2f4737ad6a24d54ef"
    ]
  },
  "actions": {
    "events": 28,
    "tool_calls": 3,
    "evidence_ids": [
      "ev_bee6c43e361930bf06a7",
      "ev_93335ba000ab4931a538",
      "ev_1ecc50482a7fe765093a",
      "ev_f40a5a16a560e4b5b4bc",
      "ev_9e245ff8e4d1a298bf43",
      "ev_f7956e512271ed88ffb2"
    ]
  },
  "changes": {
    "changed_files": [
      "w2-run.sqlite",
      "w2-run.sqlite-shm",
      "w2-run.sqlite-wal"
    ],
    "additions": 0,
    "deletions": 0,
    "evidence_ids": [
      "ev_b54f1bbc6a2c6f9c8be1"
    ]
  },
  "verification": {
    "results": [],
    "evidence_ids": []
  },
  "evidence": [
    {
      "evidence_id": "ev_efe2f4737ad6a24d54ef",
      "run_id": "4296fcb3-b3e9-45de-b456-d49a54c06348",
      "type": "CONTEXT_EVIDENCE",
      "source": "sqlite:runs.context_manifest",
      "summary": "1 files supplied from 6 considered",
      "raw_reference": "run:4296fcb3-b3e9-45de-b456-d49a54c06348:context",
      "confidence_class": "DETERMINISTIC",
      "created_at": "2026-09-22T14:35:18.802Z",
      "data": {
        "files_considered": 6,
        "files_included": 1,
        "approximate_tokens": 15
      }
    },
    {
      "evidence_id": "ev_bee6c43e361930bf06a7",
      "run_id": "4296fcb3-b3e9-45de-b456-d49a54c06348",
      "type": "TOOL_EVIDENCE",
      "source": "sqlite:tool_calls",
      "summary": "shell executed",
      "raw_reference": "run:4296fcb3-b3e9-45de-b456-d49a54c06348:tool:0",
      "confidence_class": "DETERMINISTIC",
      "created_at": "2026-09-22T14:35:18.799Z",
      "data": {
        "tool_name": "shell",
        "input": {
          "command": "git",
          "args": [
            "status",
            "--porcelain=v1"
          ]
        },
        "result": {
          "stdout": "?? w2-run.sqlite\n?? w2-run.sqlite-shm\n?? w2-run.sqlite-wal\n",
          "stderr": "",
          "exitCode": 0
        }
      }
    },
    {
      "evidence_id": "ev_93335ba000ab4931a538",
      "run_id": "4296fcb3-b3e9-45de-b456-d49a54c06348",
      "type": "TOOL_EVIDENCE",
      "source": "sqlite:tool_calls",
      "summary": "shell executed",
      "raw_reference": "run:4296fcb3-b3e9-45de-b456-d49a54c06348:tool:1",
      "confidence_class": "DETERMINISTIC",
      "created_at": "2026-09-22T14:35:38.888Z",
      "data": {
        "tool_name": "shell",
        "input": {
          "command": "git",
          "args": [
            "status",
            "--porcelain=v1"
          ]
        },
        "result": {
          "stdout": "?? w2-run.sqlite\n?? w2-run.sqlite-shm\n?? w2-run.sqlite-wal\n",
          "stderr": "",
          "exitCode": 0
        }
      }
    },
    {
      "evidence_id": "ev_1ecc50482a7fe765093a",
      "run_id": "4296fcb3-b3e9-45de-b456-d49a54c06348",
      "type": "TOOL_EVIDENCE",
      "source": "sqlite:tool_calls",
      "summary": "shell executed",
      "raw_reference": "run:4296fcb3-b3e9-45de-b456-d49a54c06348:tool:2",
      "confidence_class": "DETERMINISTIC",
      "created_at": "2026-09-22T14:35:38.921Z",
      "data": {
        "tool_name": "shell",
        "input": {
          "command": "git",
          "args": [
            "diff",
            "HEAD",
            "--"
          ]
        },
        "result": {
          "stdout": "",
          "stderr": "",
          "exitCode": 0
        }
      }
    },
    {
      "evidence_id": "ev_f40a5a16a560e4b5b4bc",
      "run_id": "4296fcb3-b3e9-45de-b456-d49a54c06348",
      "type": "TOOL_EVIDENCE",
      "source": "sqlite:tool_calls",
      "summary": "shell executed",
      "raw_reference": "run:4296fcb3-b3e9-45de-b456-d49a54c06348:tool:3",
      "confidence_class": "DETERMINISTIC",
      "created_at": "2026-09-22T14:35:38.922Z",
      "data": {
        "tool_name": "shell",
        "input": {
          "command": "git",
          "args": [
            "diff",
            "HEAD",
            "--numstat"
          ]
        },
        "result": {
          "stdout": "",
          "stderr": "",
          "exitCode": 0
        }
      }
    },
    {
      "evidence_id": "ev_b54f1bbc6a2c6f9c8be1",
      "run_id": "4296fcb3-b3e9-45de-b456-d49a54c06348",
      "type": "DIFF_EVIDENCE",
      "source": "sqlite:runs.diff",
      "summary": "3 files changed (+0/-0)",
      "raw_reference": "run:4296fcb3-b3e9-45de-b456-d49a54c06348:diff",
      "confidence_class": "DETERMINISTIC",
      "created_at": "2026-09-22T14:35:38.924Z",
      "data": {
        "status_before": "?? w2-run.sqlite\n?? w2-run.sqlite-shm\n?? w2-run.sqlite-wal\n",
        "status_after": "?? w2-run.sqlite\n?? w2-run.sqlite-shm\n?? w2-run.sqlite-wal\n",
        "changed_files": [
          "w2-run.sqlite",
          "w2-run.sqlite-shm",
          "w2-run.sqlite-wal"
        ],
        "additions": 0,
        "deletions": 0,
        "unified_diff": ""
      }
    },
    {
      "evidence_id": "ev_9e245ff8e4d1a298bf43",
      "run_id": "4296fcb3-b3e9-45de-b456-d49a54c06348",
      "type": "ASSERTION_EVIDENCE",
      "source": "sqlite:events",
      "summary": "28 ordered events and 3 persisted tool calls",
      "raw_reference": "run:4296fcb3-b3e9-45de-b456-d49a54c06348:events",
      "confidence_class": "DETERMINISTIC",
      "created_at": "2026-09-22T14:35:38.924Z",
      "data": {
        "events": 28,
        "tool_calls": 3
      }
    },
    {
      "evidence_id": "ev_f7956e512271ed88ffb2",
      "run_id": "4296fcb3-b3e9-45de-b456-d49a54c06348",
      "type": "ASSERTION_EVIDENCE",
      "source": "sqlite:events",
      "summary": "3 safety and durability events",
      "raw_reference": "run:4296fcb3-b3e9-45de-b456-d49a54c06348:safety",
      "confidence_class": "DETERMINISTIC",
      "created_at": "2026-09-22T14:35:38.857Z",
      "data": [
        {
          "event_id": "a30a9832-591b-42fc-9aa1-8aac0dcbca33",
          "run_id": "4296fcb3-b3e9-45de-b456-d49a54c06348",
          "sequence": 2,
          "timestamp": "2026-09-22T14:35:18.766Z",
          "type": "run_checkpointed",
          "payload": {
            "sequence": 1,
            "completed_tool_calls": 0,
            "verification_progress": 0
          }
        },
        {
          "event_id": "b4943e07-1ddc-4a2b-8767-f57efbdcf710",
          "run_id": "4296fcb3-b3e9-45de-b456-d49a54c06348",
          "sequence": 7,
          "timestamp": "2026-09-22T14:35:18.803Z",
          "type": "run_checkpointed",
          "payload": {
            "sequence": 6,
            "completed_tool_calls": 1,
            "verification_progress": 0
          }
        },
        {
          "event_id": "08d21293-0757-4593-aa8b-68969ad03bfc",
          "run_id": "4296fcb3-b3e9-45de-b456-d49a54c06348",
          "sequence": 23,
          "timestamp": "2026-09-22T14:35:38.857Z",
          "type": "run_checkpointed",
          "payload": {
            "sequence": 22,
            "completed_tool_calls": 1,
            "verification_progress": 0
          }
        }
      ]
    }
  ],
  "acceptance": [
    {
      "criterion_id": "AC-01",
      "description": "Make isoDate return a UTC ISO date string for a Date input.",
      "required": true,
      "status": "UNPROVEN",
      "evidence_ids": [],
      "reason": "No evidence was mapped to this required criterion."
    }
  ],
  "outcome": "UNPROVEN",
  "generated_at": "2026-09-22T14:35:38.928Z"
}
