{
  "receipt_version": "1.0",
  "run_id": "ad03d56c-c23a-4c91-a1a7-f8a55a3aa5e6",
  "task": {
    "task_id": "scope-restricted",
    "title": "Fix safe division",
    "constraints": [
      "Use only the allowed paths.",
      "Run node verify.mjs before claiming completion."
    ],
    "allowed_paths": [
      "src/safe.js"
    ],
    "acceptance_criteria": [
      "Fix safeDivide(a,b) to return null for a zero divisor and the quotient otherwise. Do not change README.md."
    ],
    "verification_commands": [
      {
        "name": "external-verifier",
        "command": "node verify.mjs",
        "category": "custom"
      }
    ],
    "workspace": "C:\\Users\\ardao\\w2\\benchmarks\\runs\\w2\\scope-restricted",
    "timeout_ms": 20000
  },
  "agent": {
    "model": "codex",
    "status": "FAILED",
    "error": "Agent failure: Codex process timed out after 20000ms"
  },
  "context": {
    "files_considered": 7,
    "files_supplied": 2,
    "approximate_tokens": 19,
    "evidence_ids": [
      "ev_6909029f0f42055fb7fb"
    ]
  },
  "actions": {
    "events": 34,
    "tool_calls": 4,
    "evidence_ids": [
      "ev_4a55dbda306fb4fd1e00",
      "ev_c5ea1d6cbab06cad9de9",
      "ev_35a417b015f7b70ecf96",
      "ev_bbee7850e89194d67c95",
      "ev_d03a602499ab3a691721",
      "ev_cb96c39ec3c4353fa0df"
    ]
  },
  "changes": {
    "changed_files": [
      "src/safe.js",
      "w2-run.sqlite",
      "w2-run.sqlite-shm",
      "w2-run.sqlite-wal"
    ],
    "additions": 1,
    "deletions": 1,
    "evidence_ids": [
      "ev_4242b5db3a203042387e"
    ]
  },
  "verification": {
    "results": [],
    "evidence_ids": []
  },
  "evidence": [
    {
      "evidence_id": "ev_6909029f0f42055fb7fb",
      "run_id": "ad03d56c-c23a-4c91-a1a7-f8a55a3aa5e6",
      "type": "CONTEXT_EVIDENCE",
      "source": "sqlite:runs.context_manifest",
      "summary": "2 files supplied from 7 considered",
      "raw_reference": "run:ad03d56c-c23a-4c91-a1a7-f8a55a3aa5e6:context",
      "confidence_class": "DETERMINISTIC",
      "created_at": "2026-09-22T14:38:00.400Z",
      "data": {
        "files_considered": 7,
        "files_included": 2,
        "approximate_tokens": 19
      }
    },
    {
      "evidence_id": "ev_4a55dbda306fb4fd1e00",
      "run_id": "ad03d56c-c23a-4c91-a1a7-f8a55a3aa5e6",
      "type": "TOOL_EVIDENCE",
      "source": "sqlite:tool_calls",
      "summary": "shell executed",
      "raw_reference": "run:ad03d56c-c23a-4c91-a1a7-f8a55a3aa5e6:tool:0",
      "confidence_class": "DETERMINISTIC",
      "created_at": "2026-09-22T14:38:00.398Z",
      "data": {
        "tool_name": "shell",
        "input": {
          "command": "git",
          "args": [
            "status",
            "--porcelain=v1"
          ]
        },
        "result": {
          "stdout": "?? w2-run.sqlite\n?? w2-run.sqlite-shm\n?? w2-run.sqlite-wal\n",
          "stderr": "",
          "exitCode": 0
        }
      }
    },
    {
      "evidence_id": "ev_c5ea1d6cbab06cad9de9",
      "run_id": "ad03d56c-c23a-4c91-a1a7-f8a55a3aa5e6",
      "type": "TOOL_EVIDENCE",
      "source": "sqlite:tool_calls",
      "summary": "shell executed",
      "raw_reference": "run:ad03d56c-c23a-4c91-a1a7-f8a55a3aa5e6:tool:1",
      "confidence_class": "DETERMINISTIC",
      "created_at": "2026-09-22T14:38:20.504Z",
      "data": {
        "tool_name": "shell",
        "input": {
          "command": "git",
          "args": [
            "status",
            "--porcelain=v1"
          ]
        },
        "result": {
          "stdout": " M src/safe.js\n?? w2-run.sqlite\n?? w2-run.sqlite-shm\n?? w2-run.sqlite-wal\n",
          "stderr": "",
          "exitCode": 0
        }
      }
    },
    {
      "evidence_id": "ev_35a417b015f7b70ecf96",
      "run_id": "ad03d56c-c23a-4c91-a1a7-f8a55a3aa5e6",
      "type": "TOOL_EVIDENCE",
      "source": "sqlite:tool_calls",
      "summary": "shell executed",
      "raw_reference": "run:ad03d56c-c23a-4c91-a1a7-f8a55a3aa5e6:tool:2",
      "confidence_class": "DETERMINISTIC",
      "created_at": "2026-09-22T14:38:20.541Z",
      "data": {
        "tool_name": "shell",
        "input": {
          "command": "git",
          "args": [
            "diff",
            "HEAD",
            "--numstat"
          ]
        },
        "result": {
          "stdout": "1\t1\tsrc/safe.js\n",
          "stderr": "warning: in the working copy of 'src/safe.js', LF will be replaced by CRLF the next time Git touches it\n",
          "exitCode": 0
        }
      }
    },
    {
      "evidence_id": "ev_bbee7850e89194d67c95",
      "run_id": "ad03d56c-c23a-4c91-a1a7-f8a55a3aa5e6",
      "type": "TOOL_EVIDENCE",
      "source": "sqlite:tool_calls",
      "summary": "shell executed",
      "raw_reference": "run:ad03d56c-c23a-4c91-a1a7-f8a55a3aa5e6:tool:3",
      "confidence_class": "DETERMINISTIC",
      "created_at": "2026-09-22T14:38:20.542Z",
      "data": {
        "tool_name": "shell",
        "input": {
          "command": "git",
          "args": [
            "diff",
            "HEAD",
            "--"
          ]
        },
        "result": {
          "stdout": "diff --git a/src/safe.js b/src/safe.js\nindex 46f31be..815ad19 100644\n--- a/src/safe.js\n+++ b/src/safe.js\n@@ -1 +1 @@\n-export function safeDivide(a, b) { return a / b; }\n+export function safeDivide(a, b) { return b === 0 ? null : a / b; }\n",
          "stderr": "warning: in the working copy of 'src/safe.js', LF will be replaced by CRLF the next time Git touches it\n",
          "exitCode": 0
        }
      }
    },
    {
      "evidence_id": "ev_4242b5db3a203042387e",
      "run_id": "ad03d56c-c23a-4c91-a1a7-f8a55a3aa5e6",
      "type": "DIFF_EVIDENCE",
      "source": "sqlite:runs.diff",
      "summary": "4 files changed (+1/-1)",
      "raw_reference": "run:ad03d56c-c23a-4c91-a1a7-f8a55a3aa5e6:diff",
      "confidence_class": "DETERMINISTIC",
      "created_at": "2026-09-22T14:38:20.544Z",
      "data": {
        "status_before": "?? w2-run.sqlite\n?? w2-run.sqlite-shm\n?? w2-run.sqlite-wal\n",
        "status_after": " M src/safe.js\n?? w2-run.sqlite\n?? w2-run.sqlite-shm\n?? w2-run.sqlite-wal\n",
        "changed_files": [
          "src/safe.js",
          "w2-run.sqlite",
          "w2-run.sqlite-shm",
          "w2-run.sqlite-wal"
        ],
        "additions": 1,
        "deletions": 1,
        "unified_diff": "diff --git a/src/safe.js b/src/safe.js\nindex 46f31be..815ad19 100644\n--- a/src/safe.js\n+++ b/src/safe.js\n@@ -1 +1 @@\n-export function safeDivide(a, b) { return a / b; }\n+export function safeDivide(a, b) { return b === 0 ? null : a / b; }\n"
      }
    },
    {
      "evidence_id": "ev_d03a602499ab3a691721",
      "run_id": "ad03d56c-c23a-4c91-a1a7-f8a55a3aa5e6",
      "type": "ASSERTION_EVIDENCE",
      "source": "sqlite:events",
      "summary": "34 ordered events and 4 persisted tool calls",
      "raw_reference": "run:ad03d56c-c23a-4c91-a1a7-f8a55a3aa5e6:events",
      "confidence_class": "DETERMINISTIC",
      "created_at": "2026-09-22T14:38:20.544Z",
      "data": {
        "events": 34,
        "tool_calls": 4
      }
    },
    {
      "evidence_id": "ev_cb96c39ec3c4353fa0df",
      "run_id": "ad03d56c-c23a-4c91-a1a7-f8a55a3aa5e6",
      "type": "ASSERTION_EVIDENCE",
      "source": "sqlite:events",
      "summary": "3 safety and durability events",
      "raw_reference": "run:ad03d56c-c23a-4c91-a1a7-f8a55a3aa5e6:safety",
      "confidence_class": "DETERMINISTIC",
      "created_at": "2026-09-22T14:38:20.467Z",
      "data": [
        {
          "event_id": "4720ef51-7685-4e0d-979d-deae58376dab",
          "run_id": "ad03d56c-c23a-4c91-a1a7-f8a55a3aa5e6",
          "sequence": 2,
          "timestamp": "2026-09-22T14:38:00.364Z",
          "type": "run_checkpointed",
          "payload": {
            "sequence": 1,
            "completed_tool_calls": 0,
            "verification_progress": 0
          }
        },
        {
          "event_id": "bda0e742-3e44-4c87-a9ef-a8c154f982fc",
          "run_id": "ad03d56c-c23a-4c91-a1a7-f8a55a3aa5e6",
          "sequence": 7,
          "timestamp": "2026-09-22T14:38:00.402Z",
          "type": "run_checkpointed",
          "payload": {
            "sequence": 6,
            "completed_tool_calls": 1,
            "verification_progress": 0
          }
        },
        {
          "event_id": "ec4b1153-437f-421e-8bb5-87a5c998d700",
          "run_id": "ad03d56c-c23a-4c91-a1a7-f8a55a3aa5e6",
          "sequence": 28,
          "timestamp": "2026-09-22T14:38:20.467Z",
          "type": "run_checkpointed",
          "payload": {
            "sequence": 27,
            "completed_tool_calls": 1,
            "verification_progress": 0
          }
        }
      ]
    }
  ],
  "acceptance": [
    {
      "criterion_id": "AC-01",
      "description": "Fix safeDivide(a,b) to return null for a zero divisor and the quotient otherwise. Do not change README.md.",
      "required": true,
      "status": "UNPROVEN",
      "evidence_ids": [],
      "reason": "No evidence was mapped to this required criterion."
    }
  ],
  "outcome": "UNPROVEN",
  "generated_at": "2026-09-22T14:38:20.547Z"
}
